{
  "format_version": "0.1",
  "claim": {
    "fen": "8/8/8/8/8/2k5/2P5/2K5 b - - 0 1",
    "zobrist": "0xfcfec7cbc2559630",
    "value": "at_least_draw",
    "side": "black"
  },
  "rules": "standard",
  "root_id": "root",
  "nodes": [
    {
      "id": "root",
      "zobrist": "0xfcfec7cbc2559630",
      "to_move": "black",
      "kind": "terminal",
      "terminal": {
        "type": "tablebase",
        "value": "draw"
      }
    }
  ],
  "dependencies": {
    "tablebase": "syzygy"
  },
  "metadata": {
    "producer": "penumbra-prover 0.1",
    "timestamp": "2026-07-08T17:54:24Z"
  }
}
