{
  "format_version": "0.1",
  "claim": {
    "fen": "8/8/8/4k3/8/2K1P3/8/7q w - - 0 1",
    "zobrist": "0x0123456789abcdef",
    "value": "win",
    "side": "white"
  },
  "rules": "standard",
  "root_id": "root",
  "nodes": [
    {
      "id": "root",
      "zobrist": "0x0123456789abcdef",
      "to_move": "white",
      "kind": "or-node",
      "moves": [
        {
          "uci": "e3e4",
          "child_id": "n1"
        }
      ]
    },
    {
      "id": "n1",
      "zobrist": "0xfedcba0987654321",
      "to_move": "black",
      "kind": "and-node",
      "moves": [
        {
          "uci": "e5d4",
          "child_id": "n2"
        },
        {
          "uci": "e5e4",
          "child_id": "n3"
        },
        {
          "uci": "e5f4",
          "child_id": "n4"
        },
        {
          "uci": "e5f5",
          "child_id": "n5"
        },
        {
          "uci": "e5f6",
          "child_id": "n6"
        },
        {
          "uci": "e5d6",
          "child_id": "n7"
        },
        {
          "uci": "e5d5",
          "child_id": "n8"
        }
      ]
    },
    {
      "id": "n2",
      "zobrist": "0xabcd1234ef567890",
      "to_move": "white",
      "kind": "terminal",
      "terminal": {
        "type": "tablebase",
        "value": "win"
      }
    },
    {
      "id": "n3",
      "zobrist": "0x1111111111111111",
      "to_move": "white",
      "kind": "terminal",
      "terminal": {
        "type": "tablebase",
        "value": "win"
      }
    },
    {
      "id": "n4",
      "zobrist": "0x2222222222222222",
      "to_move": "white",
      "kind": "terminal",
      "terminal": {
        "type": "tablebase",
        "value": "win"
      }
    },
    {
      "id": "n5",
      "zobrist": "0x3333333333333333",
      "to_move": "white",
      "kind": "terminal",
      "terminal": {
        "type": "tablebase",
        "value": "win"
      }
    },
    {
      "id": "n6",
      "zobrist": "0x4444444444444444",
      "to_move": "white",
      "kind": "terminal",
      "terminal": {
        "type": "tablebase",
        "value": "win"
      }
    },
    {
      "id": "n7",
      "zobrist": "0x5555555555555555",
      "to_move": "white",
      "kind": "terminal",
      "terminal": {
        "type": "tablebase",
        "value": "win"
      }
    },
    {
      "id": "n8",
      "zobrist": "0x6666666666666666",
      "to_move": "white",
      "kind": "terminal",
      "terminal": {
        "type": "tablebase",
        "value": "win"
      }
    }
  ],
  "dependencies": {
    "tablebase": "syzygy"
  },
  "metadata": {
    "producer": "penumbra-prover v0.1",
    "timestamp": "2024-07-07T12:00:00Z"
  }
}
